{
  "id": 510,
  "name": "Maroon 5",
  "url": "http://www.bandsintown.com/Maroon5?came_from=67",
  "image_url": "https://s3.amazonaws.com/bit-photos/large/7481529.jpeg",
  "thumb_url": "https://s3.amazonaws.com/bit-photos/thumb/7481529.jpeg",
  "facebook_page_url": "https://www.facebook.com/maroon5",
  "mbid": "0ab49580-c84f-44d4-875f-d83760ea2cfe",
  "tracker_count": 3050849,
  "upcoming_event_count": 15
}
